{
  "schema_version": 1,
  "asset": {
    "type": "skill",
    "name": "example-skill",
    "version": "1.0.0"
  },
  "generated_at": "2026-10-08T00:00:00+00:00",
  "source": {
    "path": "./example-skill",
    "git_commit": null,
    "official_registry_reviewed_at": "2026-10-08"
  },
  "files": [],
  "validation": {
    "status": "not-run",
    "validator": null,
    "notes": []
  },
  "security": {
    "secret_scan": "not-run",
    "side_effect_review": "not-run"
  }
}
